policyId,policyName,policyType,policyDescription,premiumAmount,coverageAmount,termLength,startDate
101,SecureLife,Whole Life,Provides coverage for a fixed term with no savings,5000,1000000,20,2025-01-01
102,WholeGuard,Whole Life Insurance,Coverage for the entire life with savings benefits,8000,2000000,1,2025-02-01
103,SmartSave,Endowment Plan,Combines savings and insurance with guaranteed benefits,7000,1800000,25,2025-04-01
104,HealthProtect,Health Insurance,Covers medical expenses and hospitalizations,3000,500000,10,2025-05-01
105,RetireShield,Pension Plan,Guaranteed pension payouts post-retirement,9000,2500000,30,2025-06-01
106,FamilyCare,Group Insurance,Covers multiple family members under one plan,5500,1200000,20,2025-07-01
107,ChildSecure,Child Plan,Savings and insurance for child education and future,4500,800000,18,2025-08-01
108,AccidentGuard,Accident Cover,Covers accidental injuries and medical treatments,4000,700000,12,2025-09-01
109,TravelSafe,Travel Insurance,Covers trip cancellations,2500,500000,1,2025-10-01
